{
  "id": "discovery_glass_scar",
  "type": "discovery",
  "name": "A Line of Glass",
  "discipline": "anomalies",
  "found_at": [
    "poi_glass_scar"
  ],
  "levels": [
    {
      "entry": "A seam of green-black glass running straight across open sand. Nothing near it is scorched."
    },
    {
      "entry": "Fused sand, and only at the surface — a hand down it is ordinary. Whatever did this was fast enough that the heat never travelled."
    },
    {
      "entry": "It runs true for as far as I walked it, which was most of a morning, and it does not deviate for a dune or a ridge."
    },
    {
      "entry": "It crosses the old harbour floor without a break, and the silt underneath it is unfused. So it happened after the water left, and fast.",
      "requires": [
        "discovery_seawall_courses"
      ]
    },
    {
      "entry": "I can date it and describe it and I cannot say what it is. I have written down the bearing, which points at the gate court, and I am aware that is not an explanation."
    }
  ],
  "notes": "Deliberately unresolved, like the Cloud Stair. Its job is to date the ending, not to explain it, and the diary says so. Moved to Dwarka. Rung 3 used to be dated against the fossil channel and is now dated against the harbour floor and the seawalls, which is the same argument with the evidence that survived. The bearing pointing at the gate is new and deliberately unresolved -- its job is still to date the ending, not to explain it.",
  "epochs": [
    "epoch_post_cataclysm"
  ],
  "canon": "primary",
  "sources": [
    "Varuna's Field Diary design",
    "AI_CONTEXT.md"
  ]
}
